{
  "url": "https://discord.com/privacy",
  "selector": ".section-rich",
  "enabled": true,
  "rules": [
    {
      "name": "remove-toc",
      "filter": "a.link-terms",
      "replacement": ""
    },
    {
      "name": "remove-archive-link",
      "filter": "a.archived-link",
      "replacement": ""
    }
  ]
}
